description,evaluate,introduce,movie_name,serial_number,start
希望让人自由。,1205183人评价,1994/美国/犯罪剧情,肖申克的救赎,1,9.6
风华绝代。,886057人评价,1993/中国大陆香港/剧情爱情同性,霸王别姬,2,9.6
怪蜀黍和小萝莉不得不说的故事。,1109065人评价,1994/法国/剧情动作犯罪,这个杀手不太冷,3,9.6
一部美国近现代史。,950314人评价,1994/美国/剧情爱情,阿甘正传,4,9.6
最美的谎言。,554989人评价,1997/意大利/剧情喜剧爱情战争,美丽人生,5,9.6
失去的才是永恒的。 ,885915人评价,1997/美国/剧情爱情灾难,泰坦尼克号,6,9.6
最好的宫崎骏，最好的久石让。 ,878403人评价,2001/日本/剧情动画奇幻,千与千寻,7,9.6
拯救一个人，就是拯救整个世界。,498693人评价,1993/美国/剧情历史战争,辛德勒的名单,8,9.6
诺兰给了我们一场无法盗取的梦。,967363人评价,2010/美国英国/剧情科幻悬疑冒险,盗梦空间,9,9.6
小瓦力，大人生。,641502人评价,2008/美国/爱情科幻动画冒险,机器人总动员,10,9.6
永远都不能忘记你所爱的人。,626045人评价,2009/美国英国/剧情,忠犬八公的故事,11,9.6
英俊版憨豆，高情商版谢耳朵。,866041人评价,2009/印度/剧情喜剧爱情歌舞,三傻大闹宝莱坞,12,9.6
每个人都要走一条自己坚定了的路，就算是粉身碎骨。 ,723550人评价,1998/意大利/剧情音乐,海上钢琴师,13,9.6
天籁一般的童声，是最接近上帝的存在。 ,595500人评价,2004/法国瑞士德国/剧情音乐,放牛班的春天,14,9.6
一生所爱。,656872人评价,1995/香港中国大陆/喜剧爱情奇幻冒险,大话西游之大圣娶亲,15,9.6
如果再也不能见到你，祝你早安，午安，晚安。,637622人评价,1998/美国/剧情科幻,楚门的世界,16,9.6
千万不要记恨你的对手，这样会让你失去理智。,438653人评价,1972/美国/剧情犯罪,教父,17,9.6
爱是一种力量，让我们超越时空感知它的存在。,652913人评价,2014/美国英国加拿大冰岛/剧情科幻冒险,星际穿越,18,9.6
人人心中都有个龙猫，童年就永远不会消失。,537930人评价,1988/日本/动画奇幻冒险,龙猫,19,9.6
我们一路奋战不是为了改变世界，而是为了不让世界改变我们。,369790人评价,2011/韩国/剧情,熔炉,20,9.6
香港电影史上永不过时的杰作。,539422人评价,2002/香港/剧情犯罪悬疑,无间道,21,9.6
平民励志片。 ,699272人评价,2006/美国/剧情传记家庭,当幸福来敲门,22,9.6
满满温情的高雅喜剧。,466159人评价,2011/法国/剧情喜剧,触不可及,23,9.6
真正的幸福是来自内心深处。,753317人评价,2010/美国/剧情喜剧爱情,怦然心动,24,9.6
Tomorrow is another day.,333432人评价,1939/美国/剧情历史爱情战争,乱世佳人,25,9.6
迪士尼给我们营造的乌托邦就是这样，永远善良勇敢，永远出乎意料。,714356人评价,2016/美国/喜剧动画冒险,疯狂动物城,26,9.2
无尽的黑暗。,432810人评价,2008/美国英国/剧情动作科幻犯罪惊悚,蝙蝠侠：黑暗骑士,27,9.2
那些吻戏，那些青春，都在影院的黑暗里被泪水冲刷得无比清晰。,366058人评价,1988/意大利法国/剧情爱情,天堂电影院,28,9.2
张艺谋最好的电影。,358257人评价,1994/中国大陆香港/剧情历史家庭,活着,29,9.2
瑰丽壮观、无人能及的冒险之旅。,718406人评价,2012/美国台湾英国加拿大/剧情奇幻冒险,少年派的奇幻漂流,30,9.2
1957年的理想主义。 ,214128人评价,1957/美国/剧情,十二怒汉,31,9.2
对敌人的仁慈，就是对自己残忍。,297260人评价,2000/中国大陆/剧情历史战争,鬼子来了,32,9.2
史诗的终章。,356285人评价,2003/美国新西兰/剧情动作奇幻冒险,指环王3：王者无敌,33,9.2
比利·怀德满分作品。,144457人评价,1957/美国/剧情犯罪悬疑,控方证人,34,9.2
邪恶与平庸蛰伏于同一个母体，在特定的时间互相对峙。,471124人评价,1999/美国德国/剧情动作悬疑惊悚,搏击俱乐部,35,9.2
对天空的追逐，永不停止。 ,414039人评价,1986/日本/动画奇幻冒险,天空之城,36,9.2
最后那些最无聊的事情，才是最值得怀念的。 ,632479人评价,2009/美国/剧情喜剧动画冒险,飞屋环游记,37,9.2
旷古烁今。,528579人评价,1995/香港中国大陆/喜剧爱情奇幻冒险,大话西游之月光宝盒,38,9.2
爱情哪怕只有一天。,479702人评价,1953/美国/喜剧剧情爱情,罗马假日,39,9.2
你不是在为你一个人战斗，你要让千千万万的女性看到女生并不是只能相夫教子。,640156人评价,2016/印度/剧情传记运动家庭,摔跤吧！爸爸,40,9.2
别样人生。,283783人评价,2006/德国/剧情悬疑,窃听风暴,41,9.2
电影的现实意义大过电影本身。,281264人评价,2013/韩国/剧情,辩护人,42,9.2
4个臭皮匠顶个诸葛亮，盖·里奇果然不是盖的。,323036人评价,1998/英国/剧情喜剧犯罪,两杆大烟枪,43,9.2
史上最美的探戈。,406900人评价,1992/美国/剧情,闻香识女人,44,9.2
带着心爱的人在天空飞翔。,448479人评价,2004/日本/动画奇幻冒险,哈尔的移动城堡,45,9.2
自由万岁。,327259人评价,1975/美国/剧情,飞越疯人院,46,9.2
当一个死水般的体制内出现一个活跃的变数时，所有的腐臭都站在了光明的对面。,349051人评价,1989/美国/剧情,死亡诗社,47,9.2
一张面具背后的理想与革命。,527920人评价,2005/美国英国德国/剧情动作科幻惊悚,V字仇杀队,48,9.2
海豚的微笑，是世界上最高明的伪装。,215324人评价,2009/美国/纪录片,海豚湾,49,9.2
优雅的孤独。,237297人评价,1974/美国/剧情犯罪,教父2,50,9.2
承前启后的史诗篇章。,334018人评价,2002/美国新西兰/剧情动作奇幻冒险,指环王2：双塔奇兵,51,9.0
传说的开始。,374123人评价,2001/新西兰美国/剧情动作奇幻冒险,指环王1：魔戒再现,52,9.0
爱是一切逻辑和原由。,372339人评价,2001/美国/传记剧情,美丽心灵,53,9.0
人生不能像做菜，把所有的料都准备好了才下锅。,256739人评价,1994/台湾美国/剧情家庭,饮食男女,54,9.0
暗恋的极致。,459297人评价,1995/日本/剧情爱情,情书,55,9.0
受过伤害的人总是笑得最开心，因为他们不愿意让身边的人承受一样的痛苦。,241900人评价,2013/韩国/剧情,素媛,56,9.0
动物版《哈姆雷特》。,351418人评价,1994/美国/剧情动画冒险歌舞家庭,狮子王,57,9.0
音乐能化解仇恨。,245828人评价,2002/法国德国英国波兰/剧情传记历史战争音乐,钢琴家,58,9.0
往事如烟，无处祭奠。,211796人评价,1984/意大利美国/犯罪剧情,美国往事,59,9.0
奔跑的孩子是天使。,177686人评价,1997/伊朗/剧情家庭儿童,小鞋子,60,9.0
警察抓小偷，老鼠玩死猫。,513109人评价,1995/美国/剧情犯罪悬疑惊悚,七宗罪,61,9.0
以戏谑来戏谑戏谑。,368906人评价,2006/日本/剧情歌舞,被嫌弃的松子的一生,62,9.0
孪生蝙蝠侠大战克隆金刚狼。,419095人评价,2006/美国英国/剧情悬疑惊悚,致命魔术,63,9.0
在时间之河里感受溺水之苦。,477384人评价,2008/美国/剧情爱情奇幻,本杰明·巴顿奇事,64,9.0
“不要跟我比惨，我比你更惨”再适合这部电影不过了。,238970人评价,1987/英国意大利中国大陆法国美国/剧情传记历史,末代皇帝,65,9.0
美丽无罪。,444129人评价,2000/意大利美国/剧情战争情色,西西里的美丽传说,66,9.0
法式小清新。 ,571615人评价,2001/法国德国/喜剧爱情,天使爱美丽,67,9.0
视觉革命。,351520人评价,1999/美国澳大利亚/动作科幻,黑客帝国,68,9.0
你给我翻译翻译，神马叫做TMD的惊喜。,777231人评价,2010/中国大陆香港/剧情喜剧动作西部,让子弹飞,69,9.0
美利坚精神输出大片No1.,300203人评价,1998/美国/剧情历史战争,拯救大兵瑞恩,70,9.0
你以为你以为的就是你以为的。,470783人评价,2016/西班牙/剧情犯罪悬疑惊悚,看不见的客人,71,9.0
用音乐化解仇恨，让歌声串起美好。,280499人评价,1965/美国/剧情传记爱情歌舞,音乐之声,72,9.0
故事的高级讲法。,410696人评价,1994/美国/剧情喜剧犯罪,低俗小说,73,9.0
史诗大片的典范。,342910人评价,1995/美国/动作传记剧情历史战争,勇敢的心,74,9.0
浪漫忧郁的成人童话。,580274人评价,1990/美国/剧情奇幻爱情,剪刀手爱德华,75,9.0
经典之作，历久弥新。,136214人评价,1961(中国大陆)/1964(中国大陆)/1978(中国大陆)/2004(中国大陆)/中国大陆/动画奇幻,大闹天宫,76,9.3
安东尼·霍普金斯的顶级表演。,419651人评价,1991/美国/剧情犯罪惊悚,沉默的羔羊,77,9.3
人的命运被自己瞬间的抉择改变。,460754人评价,2004/美国加拿大/剧情悬疑科幻惊悚,蝴蝶效应,78,9.3
童话世界的开端。,348663人评价,2001/美国英国/奇幻冒险,哈利·波特与魔法石,79,9.3
爱情纠缠，男女一致。,302796人评价,1997/香港日本韩国/剧情爱情同性,春光乍泄,80,9.3
死可能是一道门，逝去并不是终结，而是超越，走向下一程。,361373人评价,2008/日本/剧情,入殓师,81,9.3
人生中应该拥有这样的一段豁然开朗。,334413人评价,1997/美国/剧情,心灵捕手,82,9.3
骗子大师和执著警探的你追我跑故事。 ,301722人评价,2002/美国加拿大/传记犯罪剧情,猫鼠游戏,83,9.3
小清新的故事里注入了大历史的情怀。,401278人评价,2014/美国德国英国/剧情喜剧冒险,布达佩斯大饭店,84,9.3
昔日翩翩少年，今日大腹便便。,441595人评价,2010/美国/剧情悬疑惊悚,禁闭岛,85,9.3
你是我最好的朋友，你是我唯一的朋友 。,262246人评价,2009/澳大利亚/剧情动画,玛丽和马克思,86,9.3
一场华丽的意淫。,327793人评价,1994/中国大陆香港/剧情,阳光灿烂的日子,87,9.3
深入内心的恐怖，出人意料的结局。,280397人评价,1999/美国/剧情悬疑惊悚,第六感,88,9.3
人与自然的战争史诗。,280333人评价,1997/日本/动画奇幻冒险,幽灵公主,89,9.3
寂寞没有期限。,399621人评价,1994/香港/剧情爱情,重庆森林,90,9.3
人言可畏。,165351人评价,2012/丹麦瑞典/剧情,狩猎,91,9.3
最不可能的那个人永远是最可能的。,385558人评价,2003/美国/剧情悬疑惊悚,致命ID,92,9.3
尽管有些不切实际的幻想，这部电影依旧是一部感人肺腑的佳作。,194179人评价,2008/英国美国/剧情战争,穿条纹睡衣的男孩,93,9.3
每个人心中都有一座断背山。,383632人评价,2005/美国加拿大/剧情爱情同性家庭,断背山,94,9.3
约翰尼·德普的独角戏。,425084人评价,2003/美国/动作冒险奇幻,加勒比海盗,95,9.3
抱着梦想而活着的人是幸福的，怀抱梦想而死去的人是不朽的。,299859人评价,2003/美国/剧情家庭奇幻冒险,大鱼,96,9.3
绝对意义上的美轮美奂。,638220人评价,2009/美国英国/动作战争科幻冒险,阿凡达,97,9.3
大时代中的人生，小人物的悲喜。,114940人评价,1936/美国/喜剧剧情爱情,摩登时代,98,9.3
没有一人完全善，也没有一人完全恶。,405968人评价,2010/日本/剧情惊悚,告白,99,9.3
我们都曾经是一一。,183140人评价,2000/台湾日本/剧情爱情家庭,一一,100,9.3
百看不厌。 ,326427人评价,1993/香港/喜剧古装,射雕英雄传之东成西就,101,8.7
相逢只要一瞬间，等待却像是一辈子。,268867人评价,1996/香港/剧情爱情,甜蜜蜜,102,8.7
再多各自牛逼的时光，也比不上一起傻逼的岁月。 ,321939人评价,2011/韩国/剧情喜剧,阳光姐妹淘,103,8.7
年度最佳date movie。,434952人评价,2014/美国/剧情犯罪悬疑惊悚,消失的爱人,104,8.7
缘分是个连绵词，最美不过一瞬。,268187人评价,1995/美国奥地利瑞士/剧情爱情,爱在黎明破晓前,105,8.7
被上帝抛弃了的上帝之城。,178742人评价,2002/巴西法国/犯罪剧情,上帝之城,106,8.7
那些静得只能听见呼吸的日子里，你明白孤独即生活。,174900人评价,2014/日本/剧情,小森林 夏秋篇,107,8.7
少女情怀总是诗。,207822人评价,1995/日本/剧情爱情动画,侧耳倾听,108,8.7
我是一个演员。,392578人评价,1999/香港/喜剧剧情爱情,喜剧之王,109,8.7
两张绝世的脸。 ,320323人评价,1987/香港/剧情爱情武侠古装,倩女幽魂,110,8.7
恐怖分子的“秋菊打官司”。,281796人评价,2013/韩国/剧情犯罪悬疑,恐怖直播,111,8.7
动画片的圣经。,207674人评价,1984/日本/动画奇幻冒险,风之谷,112,8.7
九年后的重逢是世俗和责任的交叠，没了悸动和青涩，沧桑而温暖。,236958人评价,2004/美国/剧情爱情,爱在日落黄昏时,113,8.7
穷尽一生，我们要学会的，不过是彼此拥抱。,213426人评价,2011/美国/剧情,超脱,114,8.7
梦的勾结。,167179人评价,2006/日本/动画悬疑科幻惊悚,红辣椒,115,8.7
从没见过那么流氓的温柔，从没见过那么温柔的流氓。,228351人评价,1999/日本/剧情喜剧,菊次郎的夏天,116,8.7
和谐的生活离不开摸头与被摸头。,345492人评价,2010/美国/喜剧动画奇幻冒险,驯龙高手,117,8.7
有时候幸福需要等一等。 ,264997人评价,2004/美国/喜剧剧情爱情,幸福终点站,118,8.7
Mr. I Don't Care其实也有Care的时候。,464825人评价,2010/美国法国/喜剧动画冒险,神偷奶爸,119,8.7
曾经的那段美好会沉淀为一辈子的记忆。,256293人评价,2010/日本/动画奇幻冒险,借东西的小人阿莉埃蒂,120,8.7
关于连环杀人悬案的集体回忆。,247938人评价,2003/韩国/犯罪剧情悬疑惊悚,杀人回忆,121,8.7
时代悲歌。,92862人评价,1954/日本/动作冒险剧情,七武士,122,8.7
岁月流逝，来日可追。,349836人评价,2010/香港中国大陆/剧情家庭,岁月神偷,123,8.7
沉醉在电影的情感和视听氛围中无法自拔。,235407人评价,2017/意大利法国巴西美国/剧情爱情同性,请以你的名字呼唤我,124,8.7
幸福是生生不息，却难以触及的远。 ,236175人评价,1988/日本/动画剧情战争,萤火虫之墓,125,8.7
不要给它起名字，起了名字就有感情了。,296164人评价,2001/美国/儿童喜剧动画奇幻冒险,怪兽电力公司,126,8.6
尊敬他人，尊敬你生活的这片土地，明白孤独是人生的常态。,151408人评价,2015/日本/剧情,小森林 冬春篇,127,8.6
10年的完美句点。,331601人评价,2011/美国英国/剧情悬疑奇幻冒险,哈利·波特与死亡圣器(下),128,8.6
像吃了苏打饼一样干脆的电影。,214356人评价,2007/美国德国/动作悬疑惊悚,谍影重重3,129,8.6
中国家庭的喜怒哀乐忍。,165896人评价,1993/台湾美国/剧情喜剧爱情同性家庭,喜宴,130,8.6
电影诗。,301956人评价,1994/香港台湾/剧情动作爱情武侠古装,东邪西毒,131,8.6
真相就在眼前。,232241人评价,2004/美国/悬疑惊悚恐怖,电锯惊魂,132,8.6
上帝之城+猜火车+阿甘正传+开心辞典=山寨富翁,443872人评价,2008/英国美国/剧情爱情,贫民窟的百万富翁,133,8.6
老少皆宜，这就是好莱坞动画的魅力。,434582人评价,2013/美国/喜剧动画冒险,疯狂原始人,134,8.6
一个针管引发的血案。,324786人评价,2000/美国/犯罪剧情悬疑惊悚,记忆碎片,135,8.6
《我是山姆》的《美丽人生》。,217438人评价,2013/韩国/剧情喜剧家庭,7号房的礼物,136,8.6
黑暗之美。,480938人评价,2010/美国/剧情惊悚,黑天鹅,137,8.6
触不到的恋人。,200389人评价,2011/日本/剧情爱情动画奇幻,萤火之森,138,8.6
爱，是个动词。,359365人评价,2003/英国美国法国/喜剧剧情爱情,真爱至上,139,8.6
英雄泪短，兄弟情长。 ,214845人评价,1986/香港/动作犯罪,英雄本色,140,8.6
Balalala~~~,453205人评价,2014/美国/喜剧动作科幻动画冒险,超能陆战队,141,8.6
生活在自己的世界里，也可以让周围的人显得可笑和渺小。,235281人评价,1988/美国/剧情,雨人,142,8.6
荒诞讽刺，千奇百巧，抽丝剥茧，百转千回。,223576人评价,2014/中国大陆/剧情犯罪悬疑,心迷宫,143,8.6
诺兰就是保证。,345929人评价,2012/美国英国/剧情动作科幻犯罪惊悚,蝙蝠侠：黑暗骑士崛起,144,8.6
当这个世界闭上双眼，他却敞开了怀抱。,141355人评价,2004/英国南非意大利美国/剧情历史战争,卢旺达饭店,145,8.6
华太师是黄霑，吴镇宇四大才子之一。,417209人评价,1993/香港/喜剧爱情古装,唐伯虎点秋香,146,8.6
大海啊，不全是水。,107352人评价,2009/法国瑞士西班牙美国阿联酋/纪录片,海洋,147,8.6
爱是摈弃傲慢与偏见之后的曙光。,359700人评价,2005/法国英国美国/剧情爱情,傲慢与偏见,148,8.6
始于荒诞，止于更荒诞。,179141人评价,2014/阿根廷西班牙/剧情喜剧犯罪,荒蛮故事,149,8.6
香港浪漫主义警匪动作片的巅峰之作。,182067人评价,1991/香港/剧情喜剧动作犯罪,纵横四海,150,8.6
我们都有权利不与自己的过去和解。,245380人评价,2016/美国/剧情家庭,海边的曼彻斯特,151,8.6
任何信念的力量，都无法改变命运。,157112人评价,1990/美国/剧情犯罪,教父3,152,8.6
永远看不腻的喜剧。,122153人评价,1966/法国英国/喜剧战争,虎口脱险,153,8.6
我的平常生活就是他人的幸福。,92974人评价,2004/日本/剧情,无人知晓,154,8.6
把每天当作最后一天般珍惜度过，积极拥抱生活，就是幸福。,246672人评价,2013/英国/剧情爱情奇幻,时空恋旅人,155,8.6
坏人的好总是比好人的好来得更感人。,98438人评价,1993/美国/剧情犯罪,完美的世界,156,8.6
,594907人评价,2017/美国/喜剧动画奇幻音乐,寻梦环游记,157,8.6
跨度十五年的欢乐与泪水。,225128人评价,2010/美国/喜剧动画奇幻冒险,玩具总动员3,158,8.6
传奇，不是每个人都可以拥有。,165542人评价,1994/美国/剧情爱情西部家庭,燃情岁月,159,8.6
偷情本没有这样美。,288262人评价,2000/香港/剧情爱情,花样年华,160,8.6
爱情没有那么多借口，如果不能圆满，只能说明爱的不够。 ,331878人评价,2004/美国/剧情爱情,恋恋笔记本,161,8.6
Jared Leto的腿比女人还美！,222045人评价,2013/美国/剧情传记同性,达拉斯买家俱乐部,162,8.6
优秀的战争片不会美化战场，不会粉饰死亡，不会矮化敌人，不会无视常识，最重要的，不会宣扬战争。,386824人评价,2016/美国澳大利亚/剧情传记历史战争,血战钢锯岭,163,8.6
有一些东西不应该被遗忘。,131608人评价,2015/中国大陆/纪录片,二十二,164,8.6
骨灰级歌舞片。,106565人评价,1952/美国/喜剧歌舞爱情,雨中曲,165,8.6
中国式内在的美国电影。,146476人评价,1940/美国/剧情战争爱情,魂断蓝桥,166,8.6
爱上未来的你。 ,212909人评价,2006/日本/剧情爱情科幻动画,穿越时空的少女,167,8.6
不可猜的青春迷笛。 ,277723人评价,1996/英国/犯罪剧情,猜火车,168,8.6
爱并不需要智商 。,124840人评价,2001/美国/剧情家庭,我是山姆,169,8.6
松鼠才是角儿。,319843人评价,2002/美国/喜剧动画冒险,冰川时代,170,8.6
对爱的执着，可以超越一切。,221332人评价,2001/美国/冒险剧情科幻,人工智能,171,8.6
这个世界从不善待努力的人，努力了也不一定会成功，但是知道自己在努力，就是活下去的动力。,277202人评价,2014/美国/剧情音乐,爆裂鼓手,172,8.6
愿我们都不用长大，每一座城堡都能永远存在。,277360人评价,2015/美国/喜剧动画冒险,头脑特工队,173,8.6
热血沸腾，那个低俗、性感的无耻混蛋又来了。,300025人评价,2012/美国/剧情动作西部冒险,被解救的姜戈,174,8.6
好的剧本是，就算你猜到了结局也猜不到全部。,119055人评价,1997/日本/动画奇幻惊悚,未麻的部屋,175,8.6
人生的N种可能性。,148967人评价,1950/日本/犯罪剧情悬疑,罗生门,176,8.7
世界离独裁只有五天。,152482人评价,2008/德国/剧情惊悚,浪潮,177,8.7
一个单凭体香达到高潮的男人。,316583人评价,2006/德国法国西班牙美国/剧情犯罪奇幻,香水,178,8.7
当爱情跨越年龄的界限，它似乎能变得更久远一点，成为一种责任，一种水到渠成的相濡以沫。 ,305551人评价,2008/美国德国/剧情爱情,朗读者,179,8.7
王家卫是一种风格，张国荣是一个代表。,245630人评价,1990/香港/犯罪剧情爱情,阿飞正传,180,8.7
穿越错位的时空，仰望陨落的星辰，你没留下你的名字，我却无法忘记那句“我爱你”。,589807人评价,2016/日本/剧情爱情动画,你的名字。,181,8.7
被偷走的岁月，被伤害的生命，被禁锢的灵魂，终将被希望和善意救赎。,188895人评价,2015/爱尔兰加拿大英国美国/剧情家庭,房间,182,8.7
坚硬的信仰。,149465人评价,2004/中国大陆香港/剧情犯罪,可可西里,183,8.7
不要企图在重复中寻找已经失去的爱。,383288人评价,2009/英国澳大利亚/剧情悬疑惊悚,恐怖游轮,184,8.7
他给机器起名“克里斯托弗”，因为这是他初恋的名字。,301159人评价,2014/英国美国/剧情传记战争同性,模仿游戏,185,8.7
惠及一生的美丽。,153097人评价,2015/瑞典/剧情,一个叫欧维的男人决定去死,186,8.7
只有有信仰的人才能说出事实真相。,150342人评价,2011/伊朗法国/剧情家庭,一次别离,187,8.7
养狗三日，便会对你终其一生。,75195人评价,1987/日本/剧情,忠犬八公物语,188,8.7
做一颗让别人需要你的棋子。,196430人评价,2005/美国法国/剧情犯罪,战争之王,189,8.7
诺兰的牛逼来源于内心散发出的恐惧。,93821人评价,1998/英国/犯罪悬疑惊悚,追随,190,8.7
宫崎骏的电影总让人感觉世界是美好的，阳光明媚的。,228623人评价,1989/日本/动画奇幻冒险,魔女宅急便,191,8.7
天使与魔鬼的冲撞。,195608人评价,2004/美国德国/犯罪剧情,撞车,192,8.7
哗啦啦啦啦，天在下雨，哗啦啦啦啦，云在哭泣……找自己。,223173人评价,2002/美国德国捷克/动作悬疑惊悚,谍影重重,193,8.7
来啊，互相伤害啊！,251688人评价,2016/意大利/剧情喜剧,完美陌生人,194,8.7
天使保护事件始末。,99715人评价,2007/印度/剧情儿童家庭,地球上的星星,195,8.7
弱者送给弱者的一刀。,125556人评价,1991/台湾/剧情犯罪,牯岭街少年杀人事件,196,8.7
谁说王家卫镜头很晃？,185732人评价,2004/美国德国/动作悬疑惊悚,谍影重重2,197,8.7
想你时你在闹海。,98066人评价,1979/中国大陆/冒险动画奇幻,哪吒闹海,198,8.7
故事的反转与反转，分裂电影的始祖。,99606人评价,1960/美国/悬疑惊悚恐怖,惊魂记,199,8.7
人生如此，浮生如斯。谁人言，花彼岸，此生情长意短。谁都是不懂爱的罢了。,260382人评价,1993/香港/剧情奇幻古装,青蛇,200,8.7
一场没有春天的噩梦。,127320人评价,2000/美国/剧情,梦之安魂曲,201,8.7
迪士尼和皮克斯拿错剧本的产物。,226425人评价,2012/美国/喜剧动画奇幻冒险,无敌破坏王,202,8.7
不得不说，《黑客帝国》系列是商业片与科幻、哲学完美结合的典范。,184181人评价,2003/美国澳大利亚/动作科幻,黑客帝国3：矩阵革命,203,8.7
宝莱坞的萝莉与大叔。,206855人评价,2015/印度/剧情喜剧动作,小萝莉的猴神大叔,204,8.7
爱我就给我看你的播放列表。,204248人评价,2013/美国/喜剧爱情音乐,再次出发之纽约遇见你,205,8.7
是枝裕和的家庭习作。,167725人评价,2015/日本/剧情家庭,海街日记,206,8.7
嬉笑怒骂，调风动月。,217058人评价,1992/香港中国大陆/剧情动作武侠古装,新龙门客栈,207,8.7
东京那么大，如果有一天走失了，恐怕一辈子不能再相见。,60834人评价,1953/日本/剧情家庭,东京物语,208,8.7
日本的家庭电影已经是世界巅峰了，步履不停是巅峰中的佳作。,106704人评价,2008/日本/剧情家庭,步履不停,209,8.7
少见的超越首部的续集，动作片中的经典。,163947人评价,1991/美国法国/动作科幻,终结者2：审判日,210,8.7
邓肯·琼斯继《月球》之后再度奉献出一部精彩绝伦的科幻佳作。,457960人评价,2011/美国加拿大/科幻悬疑惊悚,源代码,211,8.7
黑小鸭速效美白记。,533024人评价,2010/泰国/剧情喜剧爱情,初恋这件小事,212,8.7
天使暂时离开。,123515人评价,1999/美国/犯罪剧情奇幻悬疑,绿里奇迹,213,8.7
永远的小人物，伟大的卓别林。,53548人评价,1931/美国/喜剧剧情爱情,城市之光,214,8.7
没有了退路，只好飞向自由。,119906人评价,1991/美国法国/犯罪剧情惊悚,末路狂花,215,8.7
所谓爱情，就是话唠一路，都不会心生腻烦，彼此嫌弃。,137541人评价,2013/美国/剧情爱情,爱在午夜降临前,216,8.7
中国版《两杆大烟枪》。,369988人评价,2006/中国大陆香港/喜剧犯罪,疯狂的石头,217,8.7
