description,evaluate,introduce,movie_name,serial_number,start青春就是放弃和怀念。,350085人评价,2007/日本/动画剧情爱情,秒速5厘米,218,8.7
昆汀同学越来越变态了，比北野武还杜琪峰。,253373人评价,2009/美国德国/剧情犯罪,无耻混蛋,219,8.7
科幻真正的魅力不是视觉效果能取代的。 ,209750人评价,2007/美国/剧情科幻,这个男人来自地球,220,8.7
类型片的极致。 ,159853人评价,1996/美国/动作冒险,勇闯夺命岛,221,8.7
生病的E.T.皮肤的颜色就像柿子饼。,178433人评价,1982/美国/剧情科幻,E.T. 外星人,222,8.7
在那片深蓝中，感受来自大海的忧伤寂寞与美丽自由。,115267人评价,1988/法国美国意大利/剧情爱情,碧海蓝天,223,8.7
当发哥的风衣、墨镜出现在了凯奇身上⋯⋯,240688人评价,1997/美国/动作科幻犯罪惊悚,变脸,224,8.7
世界上有那么多女人那么多酒馆，但她偏偏走进我的这家。,140777人评价,1942/美国/剧情爱情战争,卡萨布兰卡,225,8.7
最棒的西部片。,60152人评价,1966/意大利西班牙西德/冒险西部,黄金三镖客,226,9.1
我完全康复了。,207827人评价,1971/英国美国/犯罪剧情科幻,发条橙,227,9.1
小成本大魅力。,219830人评价,2013/美国英国/科幻悬疑惊悚,彗星来的那一夜,228,9.1
新闻人的理性求真。,148892人评价,2015/美国/剧情传记,聚焦,229,9.1
生命不止，摇滚不死。,180501人评价,2009/英国德国法国/剧情喜剧音乐,海盗电台,230,9.1
每个人的内心都是深不可测的大海。 ,208686人评价,1999/美国/剧情爱情家庭,美国丽人,231,9.1
每个美丽事物背后都是滴血的现实。,156871人评价,2006/美国德国/剧情惊悚冒险,血钻,232,9.1
我不信仰上帝，但我敬畏上帝。,136335人评价,1995/德国美国/剧情犯罪悬疑惊悚,非常嫌疑犯,233,9.1
皇上无话儿。,384024人评价,2010/英国澳大利亚美国/剧情传记历史,国王的演讲,234,9.1
出门必备：本草纲目。,143895人评价,2007/美国/冒险传记剧情,荒野生存,235,9.1
"In memory, love lives forever...",191594人评价,1996/美国英国/爱情剧情战争,英国病人,236,9.1
还原真实而残酷的战争。,137330人评价,2001/美国/动作历史战争,黑鹰坠落,237,9.1
你要相信，这世上真的有爱存在，不管在什么年纪 ,68723人评价,2011/韩国/剧情爱情,我爱你,238,9.1
最美的飞翔。,56374人评价,2001/法国德国意大利西班牙瑞士/纪录片,迁徙的鸟,239,9.1
用剩余不多的时间，去燃烧整个生命。,152771人评价,2007/美国/冒险喜剧剧情,遗愿清单,240,9.1
热血沸腾，相当完美的娱乐拳击大餐。,96902人评价,2011/美国/剧情运动家庭,勇士,241,9.1
一个人的独角戏。,156815人评价,2000/美国/冒险剧情,荒岛余生,242,9.1
现代科幻电影的开山之作，最伟大导演的最伟大影片。,112285人评价,1968/英国美国/科幻惊悚冒险,2001太空漫游,243,9.1
一群演技精湛的戏骨，奉献出一个精致的黑帮小品，成就杜琪峰群戏的巅峰之作。,113982人评价,1999/香港/剧情动作犯罪,枪火,244,9.1
现实与童话交相辉映的旅程。,115984人评价,1996/日本/犯罪剧情,燕尾蝶,245,9.1
乐观比一切都有力量。,120810人评价,2008/美国/剧情传记,叫我第一名,246,9.1
大卫·林奇的梦境迷宫。,261832人评价,2001/法国美国/剧情悬疑惊悚,穆赫兰道,247,9.1
一部能引人思考的科幻励志片。,101109人评价,1997/美国/剧情科幻惊悚,千钧一发,248,9.1
捍卫人权只是信仰，一点不妨碍其行为的残忍。,110868人评价,2003/美国德国英国/剧情犯罪悬疑,大卫·戈尔的一生,249,9.1
纯净原始的笑与感动。,106569人评价,1980/博茨瓦纳南非/喜剧,上帝也疯狂,250,9.1
